{
  "schema_version": "wge.lever_registry.v1",
  "registry_id": "wge_lever_registry_v1",
  "registry_version": "1.0.0",
  "content_hash": "fb1832e267b6d99a17b27a08c3a9f7fc2968530384ecb6d5aedc1779fba8e33a",
  "levers": [
    {
      "lever_id": "focus_role_target",
      "display_name": "Focus Role Target",
      "description": "Maps the Focus Role bundle to one logical channel without changing global intensity.",
      "category": "channel_roles",
      "value_type": "logical_channel",
      "unit": null,
      "authority_tier": "tier_1",
      "authority_references": ["AD-026", "x_alpha_timing_dependency_policy_v1"],
      "minimum_trust_level": "bounded",
      "availability": "locked",
      "default_value": null,
      "minimum": 0,
      "maximum": 7,
      "step": 1,
      "allowed_values": [0, 1, 2, 3, 4, 5, 6, 7],
      "basic_visible": true,
      "advanced_visible": true,
      "locked_in_exact": true,
      "profile_mutable": true,
      "run_mutable": false,
      "dependencies": ["associated_density_emphasis"],
      "incompatibilities": ["global_playback_intensity_coupling", "render_calibration_coupling"],
      "safety_notes": ["No physical channel is inherently special.", "The standard profile has no inferred default target."],
      "implementation_phase": "WGE-2-or-later"
    },
    {
      "lever_id": "trailing_event_count",
      "display_name": "Trailing Event Count",
      "description": "Future Pulse Pattern candidate control.",
      "category": "pulse_pattern",
      "value_type": "integer",
      "unit": "events",
      "authority_tier": "tier_1",
      "authority_references": ["x_alpha_pulse_pattern_grammar_v1"],
      "minimum_trust_level": "bounded",
      "availability": "future",
      "default_value": null,
      "minimum": null,
      "maximum": null,
      "step": null,
      "allowed_values": null,
      "basic_visible": false,
      "advanced_visible": true,
      "locked_in_exact": true,
      "profile_mutable": false,
      "run_mutable": false,
      "dependencies": [],
      "incompatibilities": ["motif_time_scaling", "calibration_change"],
      "safety_notes": ["No certified range exists."],
      "implementation_phase": "WGE-2-or-later"
    },
    {
      "lever_id": "primary_to_trailing_gap",
      "display_name": "Primary to Trailing Gap",
      "description": "Future Pulse Pattern candidate control.",
      "category": "pulse_pattern",
      "value_type": "number",
      "unit": "seconds",
      "authority_tier": "tier_1",
      "authority_references": ["x_alpha_pulse_pattern_grammar_v1"],
      "minimum_trust_level": "bounded",
      "availability": "future",
      "default_value": null,
      "minimum": null,
      "maximum": null,
      "step": null,
      "allowed_values": null,
      "basic_visible": false,
      "advanced_visible": true,
      "locked_in_exact": true,
      "profile_mutable": false,
      "run_mutable": false,
      "dependencies": [],
      "incompatibilities": ["motif_time_scaling", "calibration_change"],
      "safety_notes": ["No certified range exists."],
      "implementation_phase": "WGE-2-or-later"
    },
    {
      "lever_id": "trailing_event_spacing",
      "display_name": "Trailing Event Spacing",
      "description": "Future Pulse Pattern candidate control.",
      "category": "pulse_pattern",
      "value_type": "number",
      "unit": "seconds",
      "authority_tier": "tier_1",
      "authority_references": ["x_alpha_pulse_pattern_grammar_v1"],
      "minimum_trust_level": "bounded",
      "availability": "future",
      "default_value": null,
      "minimum": null,
      "maximum": null,
      "step": null,
      "allowed_values": null,
      "basic_visible": false,
      "advanced_visible": true,
      "locked_in_exact": true,
      "profile_mutable": false,
      "run_mutable": false,
      "dependencies": [],
      "incompatibilities": ["motif_time_scaling", "calibration_change"],
      "safety_notes": ["No certified range exists."],
      "implementation_phase": "WGE-2-or-later"
    },
    {
      "lever_id": "cycle_span",
      "display_name": "Cycle Span",
      "description": "Future Pulse Pattern candidate control.",
      "category": "pulse_pattern",
      "value_type": "number",
      "unit": "seconds",
      "authority_tier": "tier_1",
      "authority_references": ["x_alpha_pulse_pattern_grammar_v1"],
      "minimum_trust_level": "bounded",
      "availability": "future",
      "default_value": null,
      "minimum": null,
      "maximum": null,
      "step": null,
      "allowed_values": null,
      "basic_visible": false,
      "advanced_visible": true,
      "locked_in_exact": true,
      "profile_mutable": false,
      "run_mutable": false,
      "dependencies": [],
      "incompatibilities": ["motif_time_scaling", "calibration_change"],
      "safety_notes": ["No certified range exists."],
      "implementation_phase": "WGE-2-or-later"
    },
    {
      "lever_id": "continuation_probability",
      "display_name": "Continuation Probability",
      "description": "Future Pulse Pattern candidate control.",
      "category": "pulse_pattern",
      "value_type": "number",
      "unit": "fraction",
      "authority_tier": "tier_1",
      "authority_references": ["x_alpha_pulse_pattern_grammar_v1"],
      "minimum_trust_level": "bounded",
      "availability": "future",
      "default_value": null,
      "minimum": null,
      "maximum": null,
      "step": null,
      "allowed_values": null,
      "basic_visible": false,
      "advanced_visible": true,
      "locked_in_exact": true,
      "profile_mutable": false,
      "run_mutable": false,
      "dependencies": [],
      "incompatibilities": ["motif_time_scaling", "calibration_change"],
      "safety_notes": ["No certified range exists."],
      "implementation_phase": "WGE-2-or-later"
    },
    {
      "lever_id": "pattern_contrast",
      "display_name": "Pattern Contrast",
      "description": "Future Pulse Pattern candidate control.",
      "category": "pulse_pattern",
      "value_type": "number",
      "unit": "relative",
      "authority_tier": "tier_1",
      "authority_references": ["x_alpha_pulse_pattern_grammar_v1"],
      "minimum_trust_level": "bounded",
      "availability": "future",
      "default_value": null,
      "minimum": null,
      "maximum": null,
      "step": null,
      "allowed_values": null,
      "basic_visible": false,
      "advanced_visible": true,
      "locked_in_exact": true,
      "profile_mutable": false,
      "run_mutable": false,
      "dependencies": [],
      "incompatibilities": ["motif_time_scaling", "calibration_change"],
      "safety_notes": ["No certified range exists."],
      "implementation_phase": "WGE-2-or-later"
    },
    {
      "lever_id": "motif_time_scale_ratio",
      "display_name": "Motif Time Scale Ratio",
      "description": "Conceptual certificate-gated whole-motif time-scaling control.",
      "category": "motif_morphology",
      "value_type": "number",
      "unit": "ratio",
      "authority_tier": "tier_3",
      "authority_references": ["x_alpha_carrier_frequency_policy_v1", "AD-015", "AD-030"],
      "minimum_trust_level": "experimental",
      "availability": "experimental_uncertified",
      "default_value": null,
      "minimum": null,
      "maximum": null,
      "step": null,
      "allowed_values": null,
      "basic_visible": false,
      "advanced_visible": true,
      "locked_in_exact": true,
      "profile_mutable": false,
      "run_mutable": false,
      "dependencies": ["future_motif_certificate"],
      "incompatibilities": ["packet_onset_link", "channel_step_link", "macro_duration_link", "calibration_change"],
      "safety_notes": ["No certified range exists.", "Not executable in WGE-1."],
      "implementation_phase": "future_certificate_gated"
    }
  ]
}
